{
  "$id": "https://padas.io/schemas/task",
  "$schema": "https://json-schema.org/draft/2019-09/schema",
  "type": "object",
  "required": [
    "id",
    "name",
    "description",
    "function",
    "definition"
  ],
  "additionalProperties": false,
  "properties": {
    "id": {
      "type": ["number", "string"]
    },
    "name": {
      "type": "string"
    },
    "description": {
      "type": "string"
    },
    "definition": true,
    "function": {
      "type": "string",
      "enum": [
        "TIMESTAMP",
        "FILTER",
        "EXTRACT",
        "PARSE_CSV",
        "PARSE_KV",
        "PDL_EXPRESSION",
        "APPLY_RULES"
      ]
    }
  },
  "if": {"required": ["function"]},
  "then": {
    "anyOf": [
      {
        "properties": {
          "function": {"const": "TIMESTAMP"},
          "definition": {"$ref": "#/definitions/timestamp"}
        }
      },
      {
        "properties": {
          "function": {"const": "FILTER"},
          "definition": {"$ref": "#/definitions/filter"}
        }
      },
      {
        "properties": {
          "function": {"const": "EXTRACT"},
          "definition": {"$ref": "#/definitions/extract"}
        }
      },
      {
        "properties": {
          "function": {"const": "PARSE_CSV"},
          "definition": {"$ref": "#/definitions/parse_csv"}
        }
      },
      {
        "properties": {
          "function": {"const": "PARSE_KV"},
          "definition": {"$ref": "#/definitions/parse_kv"}
        }
      },
      {
        "properties": {
          "function": {"const": "PDL_EXPRESSION"},
          "definition": {"$ref": "#/definitions/pdl_expression"}
        }
      },
      {
        "properties": {
          "function": {"const": "APPLY_RULES"},
          "definition": {"$ref": "#/definitions/apply_rules"}
        }
      }
    ]
  },
  "definitions": {
    "timestamp": {
      "type": "object",
      "title": "TIMESTAMP",
      "required": [
        "field",
        "format"
      ],
      "properties": {
        "field": {
          "type": "string"
        },
        "format": {
          "type": "string"
        },
        "addNewField": {
          "type": "boolean",
          "default": true
        },
        "timeFieldName": {
          "type": "string",
          "default": "_time"
        }
      }
    },
    "filter": {
      "type": "object",
      "title": "FILTER",
      "required": [
        "type",
        "value"
      ],
      "properties": {
        "type": {
          "type": "string",
          "enum": [
            "regex",
            "pdl"
          ]
        },
        "action": {
          "type": "string",
          "enum": [
            "keep",
            "drop"
          ],
          "default": "keep"
        },
        "value": {
          "type": "string"
        }
      }
    },
    "extract": {
      "type": "object",
      "title": "EXTRACT",
      "required": [
        "regex"
      ],
      "properties": {
        "field": {
          "type": "string",
          "default": "_raw"
        },
        "regex": {
          "type": "string"
        },
        "keepRaw": {
          "type": "boolean",
          "default": true
        },
        "rawFieldName": {
          "type": "string",
          "default": "_raw"
        }
      }
    },
    "parse_csv": {
      "type": "object",
      "title": "PARSE_CSV",
      "required": [
        "fieldNames"
      ],
      "properties": {
        "fieldNames": {
          "type": "string"
        },
        "delimiter": {
          "type": "string",
          "default": ","
        },
        "keepRaw": {
          "type": "boolean",
          "default": true
        },
        "rawFieldName": {
          "type": "string",
          "default": "_raw"
        }
      }
    },
    "parse_kv": {
      "type": "object",
      "title": "PARSE_KV",
      "properties": {
        "delimiter": {
          "type": "string",
          "default": "="
        },
        "keepRaw": {
          "type": "boolean",
          "default": true
        },
        "rawFieldName": {
          "type": "string",
          "default": "_raw"
        }
      }
    },
    "pdl_expression": {
      "type": "object",
      "title": "PDL_EXPRESSION",
      "properties": {
        "pdl": {
          "type": "string"
        }
      }
    },
    "apply_rules": {
      "type": "object",
      "title": "APPLY_RULES",
      "required": ["rules"],
      "properties": {
        "rules": {
          "type": "array",
          "items": {
            "type": "string"
          }
        },
        "matchAll": {
          "type": "boolean",
          "default": true
        }
      }
    }
  }
}