[
  {
    "id": 110,
    "name": "Endpoint:Rules",
    "description": "Endpoint rules",
    "function": "APPLY_RULES",
    "definition": {
      "datamodels": [
        {
          "condition": "event.code=\"1\"",
          "datamodel": "EndpointProcess",
          "matchAll": true
        },
        {
          "condition": "event.code=\"3\"",
          "datamodel": "EndpointListeningPort",
          "matchAll": true
        }
      ]
    }
  }
]