[
  {
    "id": 1,
    "name": "Test Eval",
    "description": "Map group id to name",
    "function": "PDL_EXPRESSION",
    "definition": {
      "pdl": "eval group_name=if(group_id=1,\"evil group\",\"some other group\")"
    }
  },
  {
    "id": 2,
    "name": "Test Rules",
    "description": "Apply rules for mydata",
    "function": "APPLY_RULES",
    "definition": {
      "rules" : ["test_rule_for_evil", "test_rule_for_failure"],
      "matchAll": true
    }
  }
]